vid,polnoe_naimenovanie,socrshenoe_naimenovanie,naimenovanie_ur_litca_ip,region,inn,ogrn_ogrnip,adres,telephon,email,sait,spectialist_po_classificatci,prisvoenay_categoriya,nomer_resheniya_o_prisvoenii_categorii,data_resheniya_o_prisvoenii_categorii,registratcionnyi_nomer_svidetelstva,data_vydachi_svidetelstva,srok_deistviya,acreditovanaya_organizatciya,categoria_1,kol_vo_nomerov_categoria_1,kol_vo_mest_categoria_1,categoria_2,kol_vo_nomerov_categoria_2,kol_vo_mest_categoria_2,categoria_3,kol_vo_nomerov_categoria_3,kol_vo_mest_categoria_3,itogo_nomerov
городская гостиница (отель),"Гостиница ""Северная"" ООО ""Северная""","Гостиница ""Северная""","ООО ""Северная""",Республика Карелия,1001248292,1111001009382,"185035,Россия, Республика Карелия, г .Петрозаводск, проспект Ленина, дом 21",+7(8142) 59-97-77,reception@severnaya.info,www.severnaya.info,,четыре звезды,019,21.08.2020,55/019-2020,21.08.2020,21.08.2023,"ОБЩЕСТВО С ОГРАНИЧЕННОЙ ОТВЕТСТВЕННОСТЬЮ ""КАРЕЛСЕРТИФИКАЦИЯ""",Высшая «апартмент»,2,4,Высшая «люкс»,7,14,Высшая «джуниор сюит»,7,14,32
хостел,Хостел «Брусничка» ИП Федулина Е.А.,Хостел «Брусничка»,ИП Федулина Е.А.,Республика Карелия,101400482635,317100100024522,"186000, Республика Карелия, г. Олонец, ул. Ленина, д. 21",+7(921) 2208015,brusnika.olonets@gmail.com,-,,без звёзд,355,10.08.2020,77/44/355-2020,10.08.2020,10.08.2023,"Общество с ограниченной ответственностью ""Эксперт Консалт Груп"" (ООО ""Эксперт Консалт Груп"")",«Пятая»,4,20,,,,,,,20
"(До 31.12.2020) курортный отель, база отдыха, туристская база, центр отдыха, туристская деревня (деревня отдыха), дом отдыха, пансионат и другие аналогичные средства размещения","База отдыха ""Арсенал"" ООО "" Нью Стар""","База отдыха ""Арсенал""","ООО "" Нью Стар""",Республика Карелия,1007012670,1021000943017,"186757, Россия,Республика Карелия, Сортавальский район, пгт.Вяртсиля, 4-й километр автодороги Вяртсиля-Саанлахти",+79216044033,newstar@nxt.ru,www.arsenal.ru,,без звёзд,017,03.08.2020,55/017-2020,03.08.2020,03.08.2023,"ОБЩЕСТВО С ОГРАНИЧЕННОЙ ОТВЕТСТВЕННОСТЬЮ ""КАРЕЛСЕРТИФИКАЦИЯ""",«Первая»,4,8,«Третья»,11,41,,,,49
"(До 31.12.2020) курортный отель, база отдыха, туристская база, центр отдыха, туристская деревня (деревня отдыха), дом отдыха, пансионат и другие аналогичные средства размещения","Турбаза ""Тумча"" Общество с ограниченной ответственностью «Бюро Активного Туризма «Тумча»","Турбаза ""Тумча""",Общество с ограниченной ответственностью «Бюро Активного Туризма «Тумча»,Республика Карелия,1001288538,1141001011645,"Республика Карелия, Муезерский р-н, урочище  Мергуба, оз. Мергубское",+7(495)-960-21-28,info@tumcha-rk.ru,pro-camp.ru,,без звёзд,053,27.07.2020,АА-008/053-2020,27.07.2020,27.07.2023,"Общество с ограниченной ответственность ""НЦСЭ ""Хорекаэкспертгрупп""",«Пятая»,17,74,,,,,,,74
городская гостиница (отель),"Гостиница ""Пряжа""  ООО ""Совершенство""","Гостиница ""Пряжа""","ООО ""Совершенство""",Республика Карелия,1001153629,1041000013779,"186120,Россия, Республика Карелия, Пряжинский район, пгт.Пряжа, ул.Советская, д.81",+7 921 727 25 35,roa.ptz@gmail.com,www.pryazha-hotel.ru,,одна звезда,015,05.06.2020,55//015-2020,05.06.2020,05.06.2023,"ОБЩЕСТВО С ОГРАНИЧЕННОЙ ОТВЕТСТВЕННОСТЬЮ ""КАРЕЛСЕРТИФИКАЦИЯ""",Высшая «люкс»,2,4,«Первая»,11,22,«Пятая»,5,14,40
городская гостиница (отель),"Гостиница ""Янишполе"" ООО ""Стандарт Отель""","Гостиница ""Янишполе""","ООО ""Стандарт Отель""",Республика Карелия,1003004990,1111039000368,"186206, Россия, Республика Карелия, Кондопожский район, село Янишполе, ул.Дорожная, д.29",+7 921 700 29 99,sto.hotel@yandex.ru,www.hotelm18.ru,,две звезды,014,05.06.2020,55/014-2020,05.06.2020,05.06.2023,"ОБЩЕСТВО С ОГРАНИЧЕННОЙ ОТВЕТСТВЕННОСТЬЮ ""КАРЕЛСЕРТИФИКАЦИЯ""",«Первая»,25,44,,,,,,,44
городская гостиница (отель),"Гостиница ""ГУОР г. Кондопога"" ФГБПОУ ""Государственное училище ( техникум) олимпийского резерва г. Кондопога""","Гостиница ""ГУОР г. Кондопога""","ФГБПОУ ""Государственное училище ( техникум) олимпийского резерва г. Кондопога""",Республика Карелия,1003018311,1191001003533,"186223, Республика Карелия, г. Кондопога, ул. М.Горького дом 10",8 (81451) 7 33 14,adm.oor2@yandex.ru,www.olimp-karelia.ru,,без звёзд,08-20,14.02.2020,47/028/08-2020,14.02.2020,13.02.2023,"Союз ""Ленинградская областная торгово-промышленная палата""",«Третья»,15,45,,,,,,,45
городская гостиница (отель),"Гостиница ""Северный колледж"" ГАПОУ РК ""Северный колледж""","Гостиница ""Северный колледж""","ГАПОУ РК ""Северный колледж""",Республика Карелия,1006002101,1021000922062,"186422, Республика Карелия, г.Сегежа, ул.Спиридонова, д.27",+7(814)3141041,severcollege@nc.onego.ru,https://severcollege.ru/sveden/struct/5125/,,без звёзд,07-20,07.02.2020,47/028/07-2020,07.02.2020,06.02.2023,"Союз ""Ленинградская областная торгово-промышленная палата""",«Первая»,4,8,«Четвертая»,3,6,«Пятая»,9,11,25
городская гостиница (отель),"Отель ""Саквояж"" ООО ""Гостеприимство""","Отель ""Саквояж""","ООО ""Гостеприимство""",Республика Карелия,1001251915,1111001014178,"185035, Республика Карелия, г .Петрозаводск, ул. Свердлова, дом 10",+7(8142) 76-16-61,rk-hotel@mail.ru,www.rk-hotel.ru,,четыре звезды,008,10.02.2020,55/008-2020,10.02.2020,10.02.2023,"ОБЩЕСТВО С ОГРАНИЧЕННОЙ ОТВЕТСТВЕННОСТЬЮ ""КАРЕЛСЕРТИФИКАЦИЯ""",Высшая «люкс»,2,4,Высшая «студия»,2,4,«Первая»,19,37,45
городская гостиница (отель),"Гостиница ""Культурно-деловой центр "" Маски"" ГАУ РК "" Центр народного творчества и культурных инициатив Республики Карелия""","Гостиница "" Культурно-деловой центр "" Маски""","ГАУ РК "" Центр народного творчества и культурных инициатив Республики Карелия""",Республика Карелия,1001040657,1021000544730,"185036, Республика Карелия, г. Петрозаводск, проспект К.Маркса, дом 3-а","+7 (8142) 76-14-78, 77-46-19",karelia.maski@gmail.com,нет,,две звезды,009,10.02.2020,55/009-2020,10.02.2020,10.02.2023,"ОБЩЕСТВО С ОГРАНИЧЕННОЙ ОТВЕТСТВЕННОСТЬЮ ""КАРЕЛСЕРТИФИКАЦИЯ""",Высшая «люкс»,3,6,«Первая»,20,40,«Пятая»,7,25,71
городская гостиница (отель),"Гостиница "" Карелия"" ООО ""Толвоярви""","Гостиница ""Карелия""","ООО ""Толвоярви""",Республика Карелия,1016001570,1151040000066,"186870, Республика Карелия, г. Суоярви, ул.Шельшакова, дом 1",+7 ( 81457) 5-14-19,tolvoyarvi@mail.ru,нет,,без звёзд,007,05.02.2020,55/007-2020,05.02.2020,05.02.2023,"ОБЩЕСТВО С ОГРАНИЧЕННОЙ ОТВЕТСТВЕННОСТЬЮ ""КАРЕЛСЕРТИФИКАЦИЯ""",Высшая «люкс»,2,4,«Первая»,21,36,«Четвертая»,26,50,90
городская гостиница (отель),"Гостиница ""Олония"" ООО ""Олония-тур","Гостиница ""Олония""","ООО "" Олония-тур""",Республика Карелия,1014017119,1191001004677,"186000, Республика Карелия, г. Олонец, ул.Свирских дивизий, дом 5",+7 921 016 80 01,olonya-hotel@mail.ru,www.olonya-hotel.ru,,две звезды,004,30.01.2020,55/004-2020,30.01.2020,30.01.2023,"ОБЩЕСТВО С ОГРАНИЧЕННОЙ ОТВЕТСТВЕННОСТЬЮ ""КАРЕЛСЕРТИФИКАЦИЯ""",Высшая «люкс»,3,6,«Первая»,45,70,«Третья»,1,3,79
городская гостиница (отель),"""Колледж-отель ""София""  ГАПОУ РК "" Сортавальский колледж""","""Колледж-отель ""София""","ГАПОУ РК "" Сортавальский колледж""",Республика Карелия,1007018256,1081035003543,"186792, Республика Карелия, г.Сортавала, ул.Гагарина, дом 15",+7921 461 3257,sofia-sorta@yandex.ru,www.sk-karelia.ru,,без звёзд,002,27.01.2020,55/002-2020,27.01.2020,27.01.2023,"ОБЩЕСТВО С ОГРАНИЧЕННОЙ ОТВЕТСТВЕННОСТЬЮ ""КАРЕЛСЕРТИФИКАЦИЯ""",«Пятая»,15,32,,,,,,,32
городская гостиница (отель),"экоотель ""Большая Медведица"" ООО ""Кодеранду""","экоотель ""Большая Медведица""","ООО ""Кодеранду""",Республика Карелия,1013800550,1061039018699,"186353, Россия, Республика Карелия, Медвежегорский район, местечко Войгуба",+7 (921) 010-70-00,beartour@rambler.ru,www.beartour.ru,,две звезды,094,27.01.2020,50/01/094 - 2020,27.01.2020,27.01.2023,"Общество с ограниченной ответственностью ""Сергиево-Посадский центр сертификации и мониторинга""",«Первая»,12,24,«Третья»,8,33,«Пятая»,1,4,61
"(До 31.12.2020) курортный отель, база отдыха, туристская база, центр отдыха, туристская деревня (деревня отдыха), дом отдыха, пансионат и другие аналогичные средства размещения","База отдыха ""Суйсарь"" ООО ""Суйсарь""","База отдыха "" Суйсарь""","ООО ""Суйсарь""",Республика Карелия,1001230231,1101001000704,"185502, Россия, Республика Карелия, Прионежский район, д. Суйсарь",+7 (8142) 76-89-59,info@syisar.ru,www.respect-karelia.ru,,без звёзд,093,23.12.2019,50/01/093-2019,23.12.2019,23.12.2022,"Общество с ограниченной ответственностью ""Сергиево-Посадский центр сертификации и мониторинга""",«Первая»,5,10,«Третья»,8,52,,,,62
"(До 31.12.2020) курортный отель, база отдыха, туристская база, центр отдыха, туристская деревня (деревня отдыха), дом отдыха, пансионат и другие аналогичные средства размещения","База отдыха ""Ламберг"" ООО ""Транс - Сервис""","База отдыха ""Ламберг""","ООО ""Транс - Сервис""",Республика Карелия,1007017051,1081035000188,"186790, Россия, Республика Карелия, г. Сортавала, пос. Ламберг, дом 44",+7 (921) 800-18-88,lamberg-club@mail.ru,www.lamberg-club.ru,,три звезды,093,23.12.2019,50/01/092-2019,23.12.2019,23.12.2022,"Общество с ограниченной ответственностью ""Сергиево-Посадский центр сертификации и мониторинга""",«Первая»,19,38,,,,,,,38
мотель,Мотель «Пушной» ИП Третьяков Леонид Вадимович,Мотель «Пушной»,ИП Третьяков Леонид Вадимович,Республика Карелия,771535859573,309774607801111,"186523, Республика Карелия, Беломорский район, посёлок Пушной, улица Лехтинская, дом 1",+7(921)625-00-15,info@motel-p.ru,motel-p.ru,,одна звезда,599-1,23.12.2019,77/41/599-1-2019,23.12.2019,22.12.2022,"Общество с ограниченной ответственностью ""Управляющая компания ""Отель менеджмент""",«Первая»,8,16,«Вторая»,14,26,,,,42
городская гостиница (отель),Гостиница «Акватика» Автономное учреждение Республики Карелия «Центр спортивной подготовки»,Гостиница «Акватика»,Автономное учреждение Республики Карелия «Центр спортивной подготовки»,Республика Карелия,1001038658,1031000004342,"Республика Карелия, г. Петрозаводск, ул. Пушкинская, д.7, 1 этаж","8(8142) 76-50-05, 76-50-04, 76-61-80",akvati00@mail.ru,csp-karelia.ru/objektisporta/akvatika/,,две звезды,265-р,06.11.2020,АА-022/152-2020,06.11.2020,05.11.2023,"Общество с ограниченной ответственностью ""Эндикон-Эксперт""",«Первая»,12,12,,,,,,,12
городская гостиница (отель),"Гостиница ""Piter Inn Петрозаводск"" ООО «Питер-Инн»","Гостиница ""Piter Inn Петрозаводск""",ООО «Питер-Инн»,Республика Карелия,1001303465,1157847412931,"185035, Республика Карелия, г.Петрозаводск, пл.Гагарина, д.1",88142717071,reserv@piterinn.ru,www.piterinn.ru,Розова Надежда Борисовна,четыре звезды,46-р/2,27.07.2021,АА-022/290-2021,27.07.2021,26.07.2024,"Общество с ограниченной ответственностью ""Эндикон-Эксперт""",Высшая «люкс»,4,8,Высшая «джуниор сюит»,12,24,«Первая»,164,289,321
городская гостиница (отель),"Отель ""Фрегат"" ООО ""Фрегат Сервис""","Отель ""Фрегат""","ООО ""Фрегат Сервис""",Республика Карелия,1001294997,1151001003427,"185035, г. Петрозаводск, пр. Карла Маркса, д. 1А",+7 (8142) 594203,hotel@fregatfamily.com,,Конева Светлана Юрьевна,четыре звезды,10-21,05.03.2021,47/028/10-2021,05.03.2021,04.03.2024,"Союз ""Ленинградская областная торгово-промышленная палата""",Высшая «люкс»,1,2,Высшая «джуниор сюит»,7,14,«Первая»,72,144,160
"загородный отель, туристская база, база отдыха","Туристический комплекс ""Причал"", коттедж № 8 ООО  ""Причал""","Туристический комплекс ""Причал"", коттедж № 8","Общество с ограниченной ответственностью ""Причал""",Республика Карелия,1002001876,1021000843214,"186601, Республика Карелия, Кемский р-н, п. Рабочеостровск, ул. Вокзальная",+7 81458 56060,prichalkem@yandex.ru,www.prichalrk.ru,Розова Надежда Борисовна,две звезды,14-р/2,18.05.2021,АА-022/275-2021,18.05.2021,17.05.2024,"Общество с ограниченной ответственностью ""Эндикон-Эксперт""",«Первая»,28,44,,,,,,,44
городская гостиница (отель),Гостиница «Cosmos Petrozavodsk Hotel» ООО «Онега Палас»,Cosmos Petrozavodsk Hotel,"Общество с ограниченной ответственностью ""Онега Палас""",Республика Карелия,1001185003,1061001075321,"185035, Республика Карелия, г. Петрозаводск, ул. Куйбышева, д. 26",88142790790,hotel@onegopalace.com,http://onegopalace.com/,,четыре звезды,7739-2022-102-2,06.12.2019,77/39/102-2-2019,06.12.2019,07.12.2022,"Общество с ограниченной ответственностью ""Строим Отель""",Высшая «сюит»,2,4,Высшая «люкс»,2,4,Высшая «джуниор сюит»,1,2,10
"загородный отель, туристская база, база отдыха",Гостинично-туристический комплекс «Ладожская Усадьба» ООО «ГТК «Ладожская Усадьба»,Гостинично-туристический комплекс «Ладожская Усадьба»,ООО «ГТК «Ладожская Усадьба»,Республика Карелия,1007021940,1121035000525,"186792, Республика Карелия, г. Сортавала, п. Ниэмелянхови, ул.Озерная, д.1",+ 7 (921) 700-15-15; + 7 (800) 100-29-92;,info@ladoga-usadba.ru,www.ladoga-usadba.ru,Биткулов М.И.,четыре звезды,773.ЦК,19.10.2021,78/АА-034/612-2021,20.10.2021,19.10.2024,"Общество с ограниченной ответственностью ""Звезды Отелям""",Высшая «апартмент»,17,102,,,,,,,102
городская гостиница (отель),СПА Отель «Карелия» (Hotel Karelia & SPA) ООО «ТХ «Отель Карелия»,СПА Отель «Карелия» (Hotel Karelia & SPA),ООО «Турхолдинг «Отель Карелия»,Республика Карелия,7811681057,1187847031888,"185005, Республика Карелия, г. Петрозаводск, наб. Гюллинга, д.2",88142791368,reserv@hotel.karelia.ru,http://karelia-hotel.ru/,Гостенина Татьяна Николаевна,четыре звезды,059,18.11.2021,77/АА-119-2021/59-2021,18.11.2021,17.11.2024,"Общество с ограниченной ответственностью ""Спутник - спорт энд бизнес тревел""",Высшая «апартмент»,10,20,Высшая «джуниор сюит»,15,30,«Первая»,103,157,207
городская гостиница (отель),Мини-отель «Акватика» Автономное учреждение Республики Карелия «Центр спортивной подготовки» (АУ РК «ЦСП»),Мини-отель «Акватика»,Автономное учреждение Республики Карелия «Центр спортивной подготовки» (АУ РК «ЦСП»),Республика Карелия,1001038658,1031000004342,"185035, Республика Карелия, г. Петрозаводск, ул. Пушкинская, д. 7","(8142) 76-50-05, 76-50-04, 76-61-80",akvati00@mail.ru,csp-karelia.ru/objektisporta/akvatika/,,три звезды,272-р,10.11.2020,АА-022/157-2020,10.11.2020,09.11.2023,"Общество с ограниченной ответственностью ""Эндикон-Эксперт""",«Первая»,8,14,,,,,,,14
городская гостиница (отель),Гостиница «Мини отель «Илма»  ООО «ИЛМА - ТУР»,Гостиница «Мини отель «Илма»,ООО «ИЛМА - ТУР»,Республика Карелия,1001316489,1161001063728,"185000, Респ.Карелия, г. Петрозаводск, ул. Володарского, д. 10.","+79116614516, 8 (814) 2570110",hotelilma@yandex.ru,ilmahotel.ru,,три звезды,0016,17.12.2019,47/2/16-2019,19.12.2019,07.12.2022,"Общество с ограниченной ответственностью ""ОТЕЛЬ-КОНСАЛТ""",«Первая»,15,31,,,,,,,31
городская гостиница (отель),Отель «Гандвик» ИП Третьяков Леонид Вадимович,Отель «Гандвик»,ИП Третьяков Леонид Вадимович,Республика Карелия,771535859573,309774607801111,"186500, Республика Карелия, Беломорский  район, город  Беломорск, улица  Первомайская, дом 18",+7(911) 0524254,info@hotel-gandvik.ru,hotel-gandvik.ru,,три звезды,599-2,23.12.2019,77/41/599-2-2019,23.12.2019,22.12.2022,"Общество с ограниченной ответственностью ""Управляющая компания ""Отель менеджмент""",«Первая»,45,90,,,,,,,90
городская гостиница (отель),"Гостиница ""Руна"" ООО ""ЛаЛ""","Гостиница ""Руна""","ООО ""ЛаЛ""",Республика Карелия,1001181680,1061001070096,"185002,Россия, Республика Карелия, г. Петрозаводск, ул. Чапаева, дом 6А",+7 (8142) 67-22-26,hotel_runa@bk.ru,www.runahotel.karelia.ru,,две звезды,095,23.12.2019,50/01/095-2019,23.12.2019,23.12.2022,"Общество с ограниченной ответственностью ""Сергиево-Посадский центр сертификации и мониторинга""",«Первая»,8,16,«Третья»,8,25,,,,41
городская гостиница (отель),"Гостиница ""Визит-Центр ""Прокопьевский"" Муниципальное бюджетное учреждение культуры ""Горняк""","Гостиница ""Визит-Центр ""Прокопьевский""","Муниципальное бюджетное учреждение культуры ""Горняк""",Республика Карелия,1018003999,1061002012323,"186670, Россия, Республика Карелия, Лоухский район, пгт. Чупа, ул. Пионерская, дом 94",+7 (81439) 3-13-84,chupaclub@mail.ru,-,,без звёзд,096,23.12.2019,50/01/096-2019,23.12.2019,23.12.2022,"Общество с ограниченной ответственностью ""Сергиево-Посадский центр сертификации и мониторинга""",«Первая»,4,8,«Пятая»,6,45,,,,53
городская гостиница (отель),"Гостиница ""Сеурахуоне"" АУ СМР "" Социально-культурный молодежный центр""","Гостиница ""Сеурахуоне""","АУ СМР "" Социально-культурный молодежный центр""",Республика Карелия,1007019027,1101035000285,"186790, Республика Карелия, г. Сортавала, ул.Карельская, дом 22",+7(81430) 4-57-41,seurahuone@mail.ru,www.hotel.seurahuone.ru,,две звезды,001,27.01.2020,55/001-2020,27.01.2020,27.01.2023,"ОБЩЕСТВО С ОГРАНИЧЕННОЙ ОТВЕТСТВЕННОСТЬЮ ""КАРЕЛСЕРТИФИКАЦИЯ""",«Первая»,33,63,,,,,,,63
