vid,polnoe_naimenovanie,socrshenoe_naimenovanie,naimenovanie_ur_litca_ip,region,inn,ogrn_ogrnip,adres,telephon,email,sait,spectialist_po_classificatci,prisvoenay_categoriya,nomer_resheniya_o_prisvoenii_categorii,data_resheniya_o_prisvoenii_categorii,registratcionnyi_nomer_svidetelstva,data_vydachi_svidetelstva,srok_deistviya,acreditovanaya_organizatciya,categoria_1,kol_vo_nomerov_categoria_1,kol_vo_mest_categoria_1,categoria_2,kol_vo_nomerov_categoria_2,kol_vo_mest_categoria_2,categoria_3,kol_vo_nomerov_categoria_3,kol_vo_mest_categoria_3,itogo_nomerov
городская гостиница (отель),"Отель ""ВелТ"" ООО ""ВелТ-Карельские путешествия""","Отель ""ВелТ""","ООО ""ВелТ-Карельские путешествия""",Республика Карелия,1017009860,1031001190220,"186910, Республика Карелия, Калевальский район, пгт.Калевала, ул.Советская, дом 28А",+7 (81454) 4-23-00,info@kaleval-welt.ru,www.kalevala-welt.ru,Сычева Любовь Алексеевна,две звезды,061,20.12.2021,10/АА-036/061-2021,20.12.2021,20.12.2024,"ОБЩЕСТВО С ОГРАНИЧЕННОЙ ОТВЕТСТВЕННОСТЬЮ ""КАРЕЛСЕРТИФИКАЦИЯ""",«Первая»,9,12,«Третья»,6,12,,,,24
"загородный отель, туристская база, база отдыха","Эко-отель ""Karjala Park"" ООО ""КАРЕЛИЯ ПАРК""","Эко-отель ""Karjala Park""","ООО ""КАРЕЛИЯ ПАРК""",Республика Карелия,1001253800,1121001000724,"186131, Россия, Республика Карелия, Пряжинский район,пос.Матросы, Местность Сойважпорог, д.3",+7 8003333968,info@karjalapark.ru,www.karjalapark.ru,Сычева Любовь Алексеевна,три звезды,060,16.12.2021,10/АА-036/060-2021,16.12.2021,16.12.2024,"ОБЩЕСТВО С ОГРАНИЧЕННОЙ ОТВЕТСТВЕННОСТЬЮ ""КАРЕЛСЕРТИФИКАЦИЯ""",Высшая «люкс»,2,4,«Первая»,6,12,,,,16
городская гостиница (отель),"Гостиница ""Онежская"" ООО ""Норд-Плюс""","Гостиница ""Онежская""","ООО ""Норд-Плюс""",Республика Карелия,1004010386,1031001091153,"186350, Республика Карелия, г.Медвежьегорск,ул.Дзержинского, дом 2",+7 (81434) 5-64-95,sollntse@mail.ru,нет,Сычева Л.А.,без звёзд,059,06.12.2021,10/АА-036/059-2021,06.12.2021,06.12.2024,"ОБЩЕСТВО С ОГРАНИЧЕННОЙ ОТВЕТСТВЕННОСТЬЮ ""КАРЕЛСЕРТИФИКАЦИЯ""",«Первая»,24,47,«Третья»,15,45,«Пятая»,27,62,154
"загородный отель, туристская база, база отдыха","Загородный отель ""Комплекс гостевых домов ""Вепсский хутор"" ИП Подлесных Сергей Николаевич","Загородный отель ""Комплекс гостевых домов ""Вепсский хутор""",ИП Подлесных Сергей Николаевич,Республика Карелия,470304797104,319100100007608,"185512, Республика Карелия, Прионежский район, пос.Кварцитный, ул.Скалистая, д.19, к.1","+7 9214573998, +7 9116618512",onegofish@bk.ru,onegofish.ru,Сычева Любовь Алексеевна,без звёзд,058,04.12.2021,10/АА-036/058-2021,04.12.2021,04.12.2024,"ОБЩЕСТВО С ОГРАНИЧЕННОЙ ОТВЕТСТВЕННОСТЬЮ ""КАРЕЛСЕРТИФИКАЦИЯ""",«Первая»,4,8,«Третья»,5,20,,,,28
городская гостиница (отель),"Гостиница ""Заречная"" ИП Зубарева Елена Викторовна","Гостиница ""Заречная""",ИП Зубарева Елена Викторовна,Республика Карелия,100108596092,309100108600043,"185035, Республика Карелия, г.Петрозаводск, Лососинская набережная, д.7-а","+7 (8142) 592-220, 57-45-17",zarekoy@mail.ru,www.zarekoy.ru,Сычева Любовь Алексеевна,три звезды,057,04.12.2021,10/АА-036/057-2021,04.12.2021,04.12.2024,"ОБЩЕСТВО С ОГРАНИЧЕННОЙ ОТВЕТСТВЕННОСТЬЮ ""КАРЕЛСЕРТИФИКАЦИЯ""",«Первая»,21,30,,,,,,,30
городская гостиница (отель),"Мини-отель ""Вояж"" ООО ""МИНИ ОТЕЛЬ ВОЯЖ""","Мини-отель ""Вояж""","ООО ""МИНИ ОТЕЛЬ ВОЯЖ""",Республика Карелия,1001274278,1131001011382,"185013, Россия,Республика Карелия, г.Петрозаводск,ул.Пограничная,дом 52, пом.6",+7(8142) 501-501,voyageptz@mail.ru,нет,Сычева Любовь Алексеевна,без звёзд,053,13.10.2021,10/АА-036/053-2021,13.10.2021,13.10.2024,"ОБЩЕСТВО С ОГРАНИЧЕННОЙ ОТВЕТСТВЕННОСТЬЮ ""КАРЕЛСЕРТИФИКАЦИЯ""",«Первая»,3,6,«Пятая»,7,21,,,,27
"загородный отель, туристская база, база отдыха","Гостиница ""Черные камни"" ООО ""Зоо гринпарк-Карелия""","Гостиница ""Черные камни""","ООО ""Зоо гринпарк-Карелия""",Республика Карелия,1007019845,1111035000504,"186790, Россия, Республика Карелия, г. Сортавала, поселок Киркколахти",+7 9219671616,info@black-rocks.ru,black-rocks.ru,Сычева Любовь Алексеевна,три звезды,051,15.07.2021,10/АА-036/051-2021,15.07.2021,15.07.2024,"ОБЩЕСТВО С ОГРАНИЧЕННОЙ ОТВЕТСТВЕННОСТЬЮ ""КАРЕЛСЕРТИФИКАЦИЯ""",Высшая «люкс»,5,10,Высшая «джуниор сюит»,2,4,«Первая»,23,46,60
городская гостиница (отель),"МИНИ-ОТЕЛЬ «УЮТ» ООО ""Гостевой дом ""Уют""",МИНИ-ОТЕЛЬ «УЮТ»\t,"ООО ""Гостевой дом ""Уют""",Республика Карелия,1014017140,1197847148070,"186007, Республика Карелия, Олонецкий район, с. Видлица, ул. Десанта, 5",+7 921 628-20-29,otel.uyt@mail.ru,otel-uyut-karelia.ru,Батьков К.В.,две звезды,808,28.06.2021,78/АА-46/808-2021,28.06.2021,27.06.2024,"Общество с ограниченной ответственностью ""Бюро классификации и экспертизы""",«Первая»,9,18,,,,,,,18
хостел,"Хостел ""Лампо"" ООО «Станица»","Хостел ""Лампо""",Общество с ограниченной ответственностью «Станица»,Республика Карелия,1007019242,1101035000880,"186790, Республика Карелия, г.Сортавала, ул.Ленина, 6А",+7 (921) 624-05-05,hostellampo@mail.ru,www.lampohostel.ru,Пасько Ольга Владимировна,без звёзд,187,25.06.2021,АА-008/187-2021,25.06.2021,25.06.2024,"Общество с ограниченной ответственность ""НЦСЭ ""Хорекаэкспертгрупп""",«Пятая»,8,26,,,,,,,26
хостел,"Хостел ""На Гористой"" ООО ""Элит Профи""","Хостел ""На Гористой""","ООО ""Элит Профи""",Республика Карелия,1001153499,1041000013251,"186615, Россия, Республика Карелия, г.Кемь, ул.Гористая, дом 10А, административный корпус",+7 9215297600,Elitprofi19@yandex.ru,www//.keminfotur.ru,Сычева Любовь Алексеевна,без звёзд,049,24.06.2021,10/АА-036/049-2021,24.06.2021,24.06.2024,"ОБЩЕСТВО С ОГРАНИЧЕННОЙ ОТВЕТСТВЕННОСТЬЮ ""КАРЕЛСЕРТИФИКАЦИЯ""",«Первая»,2,4,«Пятая»,10,46,,,,50
хостел,"Хостел ""Удача"" ООО ""Ира""","Хостел ""Удача""","ООО ""Ира""",Республика Карелия,1007026867,1161001058151,"186792, Россия, Республика Карелия, г.Сортавала, ул.Карельская, дом 27",+79215263933,alisgods@mail.ru,нет,Сычева Любовь Алексеевна,без звёзд,048,18.06.2021,10/АА-036/048-2021,18.06.2021,18.06.2024,"ОБЩЕСТВО С ОГРАНИЧЕННОЙ ОТВЕТСТВЕННОСТЬЮ ""КАРЕЛСЕРТИФИКАЦИЯ""",«Пятая»,9,33,,,,,,,33
"загородный отель, туристская база, база отдыха",Отель «Точка на карте Сортавала» ООО «Точка на карте»,Отель «Точка на карте Сортавала»,Общество с ограниченной ответственностью «Точка на карте»,Республика Карелия,1007027148,1171001003909,"186790, Республика Карелия, г. Сортавала, п.Рюттю, д.1/2.",+7 (921) 805-05-20,booking_sortavala@tochkanakarte.ru,https://tochkanakarte.ru/,Бугровский Е.В.,три звезды,77АА115-2024-297,05.06.2021,77/АА-115-2021/295-2021,05.06.2021,04.06.2024,"Общество с ограниченной ответственностью ""Строим Отель""",«Первая»,61,122,,,,,,,122
городская гостиница (отель),"Отель ""Лофт"" ООО ""Феникс""","Отель ""Лофт""","ООО ""Феникс""",Республика Карелия,1001337111,1181001008858,"105030, Россия, Республика Карелия, г. Петрозаводск, пр.А.Невского, д.47, помещение 3",+79215577999,hotel-loft-ptz@mail.ru,hotel-loft-ptz.ru,Сычева Любовь Алексеевна,две звезды,045,11.06.2021,10/АА-036/045-2021,11.06.2021,11.06.2024,"ОБЩЕСТВО С ОГРАНИЧЕННОЙ ОТВЕТСТВЕННОСТЬЮ ""КАРЕЛСЕРТИФИКАЦИЯ""",«Первая»,6,12,«Пятая»,4,12,,,,24
"загородный отель, туристская база, база отдыха","Гостиница ""Щучье озеро"" ООО ""Второй городок""","Гостиница ""Щучье озеро""","ООО ""Второй городок""",Республика Карелия,1012009377,1091035000132,"186730, Россия, Республика Карелия, г.Лахденпохъя, ул.Малиновского, д.2-а",+7 9214580784,vtoroigorodok@mail.ru,нет,Сычева Любовь Алексеевна,без звёзд,043,31.03.2021,10/АА-036/043-2021,31.03.2021,31.03.2024,"ОБЩЕСТВО С ОГРАНИЧЕННОЙ ОТВЕТСТВЕННОСТЬЮ ""КАРЕЛСЕРТИФИКАЦИЯ""",«Первая»,12,24,«Вторая»,12,52,«Пятая»,3,32,108
городская гостиница (отель),ГОСТИНИЦА «КОРАЛ» ООО «Трове Петрозаводск»,ГОСТИНИЦА «КОРАЛ»,ООО «Трове Петрозаводск»,Республика Карелия,1001270266,1131001007026,"Республика Карелия, г. Петрозаводск, ул. Пограничная, д. 50, 2 этаж,  11 этажной секции",+7(921)7269080,koral-hotel@mail.ru,http://koral-hotel.ru/,,без звёзд,51-20,21.12.2020,47/028/48-2020,21.12.2020,20.12.2023,"Союз ""Ленинградская областная торгово-промышленная палата""",«Третья»,6,18,«Пятая»,7,23,,,,41
"курортный отель, санаторий, дом отдыха, центр отдыха, пансионат","Санаторий ""Марциальные воды"" ООО ""Санаторий ""Марциальные воды","Санаторий "" Марциальные воды""","ООО ""Санаторий ""Марциальные воды""",Республика Карелия,1001022834,1021000526436,"185901,Россия, Республика Карелия, Кондопожский район, поселок Марциальные воды","88001001719,+7 (8142) 44-54-81",director@marcwater.com,марцводы.рф,Сычева Любовь Алексеевна,две звезды,041,05.02.2021,10/АА-036/041-2021,05.02.2021,05.02.2024,"ОБЩЕСТВО С ОГРАНИЧЕННОЙ ОТВЕТСТВЕННОСТЬЮ ""КАРЕЛСЕРТИФИКАЦИЯ""",Высшая «люкс»,6,12,«Первая»,90,167,«Вторая»,9,27,206
"(До 31.12.2020) курортный отель, база отдыха, туристская база, центр отдыха, туристская деревня (деревня отдыха), дом отдыха, пансионат и другие аналогичные средства размещения",Комплекс гостевых домов «KARJU KALA» ООО «ГАРМОНИЯ»,Комплекс гостевых домов «KARJU KALA»,ООО «ГАРМОНИЯ»,Республика Карелия,101401720,1191001007878,"186004, Республика Карелия, Олонецкий район, село Нурмойла, улица Ладожская, д.8",+7 (921) 014 23 60,Karju-kala-karelija@mail.ru,http://karju-kala.ru,,без звёзд,383,28.12.2020,77/44/383-2020,28.12.2020,28.12.2023,"Общество с ограниченной ответственностью ""Эксперт Консалт Груп"" (ООО ""Эксперт Консалт Груп"")",«Первая»,6,12,,,,,,,12
городская гостиница (отель),"Отель "" Топаз-Кола"" ООО ПКФ ""Топаз""","Отель "" Топаз-Кола""","ООО ПКФ "" Топаз""",Республика Карелия,1006003271,1021000922260,"Россия, Республика Карелия,Сегежский муниципальный район, Поповпорожское сельское поселение,территория ""Топаз"", 721-й км, строение 1",+ 7 9116618330,hotel.topaz-kola@mail.ru,нет,,без звёзд,039,25.12.2020,55/039-2020,25.12.2020,25.12.2023,"ОБЩЕСТВО С ОГРАНИЧЕННОЙ ОТВЕТСТВЕННОСТЬЮ ""КАРЕЛСЕРТИФИКАЦИЯ""",«Первая»,9,18,«Третья»,4,14,,,,32
"(До 31.12.2020) дома отдыха, пансионаты и другие аналогичные средства размещения",Отель «Точка на карте Видлица» ООО «Точка на карте Видлица»,Отель «Точка на карте Видлица»,Общество с ограниченной ответственностью «Точка на карте Видлица»,Республика Карелия,1007027839,1191001010595,"186007, Республика Карелия, Олонецкий национальный муниципальный район, Видлицкое сельское поселение, район с. Видлица, земельный участок №115",+7 (812) 317-77-67,vidlitsa@tochkanakarte.ru,https://tochkanakarte.ru/vidlitsa,Кривошеин А.Н.,три звезды,77АА115-2022-282-1,19.11.2021,77/АА-115-2021/282-1-2021,20.11.2021,10.12.2023,"Общество с ограниченной ответственностью ""Строим Отель""",Высшая «апартмент»,15,30,,,,,,,30
городская гостиница (отель),"Гостиничный комплекс ""Сегежа"" ИП Преминина Е.В.","Гостиничный комплекс ""Сегежа""",Индивидуальный предприниматель Преминина Елена Владимировны,Республика Карелия,100601389948,305100620600025,"186424, Россия, Республика Карелия, г Сегежа, ул.Лесокультурная, дом 4",+7 9218003050,g.k.s@inbox.ru,www.hotelsegezha.ru,,без звёзд,033,29.10.2020,55/033-2020,29.10.2020,29.10.2023,"ОБЩЕСТВО С ОГРАНИЧЕННОЙ ОТВЕТСТВЕННОСТЬЮ ""КАРЕЛСЕРТИФИКАЦИЯ""",Высшая «люкс»,4,5,«Первая»,41,50,«Третья»,10,36,91
городская гостиница (отель),"Гостиница ""Villa Vitele"" ИП Моисеев А.А.","Гостиница ""Villa Vitele""",Индивидуальный предприниматель Моисеев Алексей Александрович,Республика Карелия,100117205500,313103534700018,"186007, Россия, Республика Карелия, Олонецкий район, поселок Устье Видлицы, ул.Рыбацкая, д.3А",+7 9212218091,villavitele@gmail.com,www.villavitele.ru,,три звезды,035,29.10.2020,55/035-2020,29.10.2020,29.10.2023,"ОБЩЕСТВО С ОГРАНИЧЕННОЙ ОТВЕТСТВЕННОСТЬЮ ""КАРЕЛСЕРТИФИКАЦИЯ""",Высшая «люкс»,2,4,«Первая»,10,20,,,,24
городская гостиница (отель),"Мини-отель ""Пулонга"" ИП Амосова Мария Алексеевна","Мини-отель ""Пулонга""",ИП Амосова Мария Алексеевна,Республика Карелия,100115128320,318100100011559,"186671,Россия, Республика Карелия, Лоухский район, деревня .Нижняя Пулонга,",+7 9212228886,pulonga2013@gmail.com,www.karelia.name,,без звёзд,037,30.10.2020,55/037-2020,30.10.2020,30.10.2023,"ОБЩЕСТВО С ОГРАНИЧЕННОЙ ОТВЕТСТВЕННОСТЬЮ ""КАРЕЛСЕРТИФИКАЦИЯ""",«Пятая»,5,11,,,,,,,11
городская гостиница (отель),"Гостиница ""КарелОнего"" ООО ""Белые ночи""","Гостиница ""КарелОнего""","ООО "" Белые ночи""",Республика Карелия,1001339084,1191001000431,"186150,Россия,Республика Карелия, г. Пудож, ул.К.Маркса, д 58",+7 9114100505,ira.1970.1@yandex.ru,нет,,без звёзд,034,29.10.2020,55/034-2020,29.10.2020,29.10.2023,"ОБЩЕСТВО С ОГРАНИЧЕННОЙ ОТВЕТСТВЕННОСТЬЮ ""КАРЕЛСЕРТИФИКАЦИЯ""",«Первая»,4,12,«Пятая»,16,31,,,,43
городская гостиница (отель),"Гостиница ""Карху"" ООО ""Карху""","Гостиница ""Карху""","ООО "" Карху""",Республика Карелия,1013008707,1181001004480,"186350,Россия, Республика Карелия, г. Медвежьегорск, ул.Лесная, дом 1",+7 9027709066,karhuhotel@mail.ru,karhu-hotel.ru,,две звезды,031,21.10.2020,55/031-2020,21.10.2020,21.10.2023,"ОБЩЕСТВО С ОГРАНИЧЕННОЙ ОТВЕТСТВЕННОСТЬЮ ""КАРЕЛСЕРТИФИКАЦИЯ""",«Первая»,12,18,«Вторая»,1,3,,,,21
городская гостиница (отель),Гостевой комплекс «Лопский берег» ИП Легкий Евгений Анатольевич,«Лопский берег»,Индивидуальный предприниматель Легкий Евгений Анатольевич,Республика Карелия,101100706637,319100100017110,"186522, Республика Карелия, Беломорский муниципальный район, Сумпосадское сельское поселение, с. Колежма, д. 1А",+7 (911) 412 30 77,info@lightsofnorth.ru,lopskybereg.ru,,без звёзд,741,14.10.2020,77/41/741-2020,15.10.2020,13.10.2023,"Общество с ограниченной ответственностью ""Управляющая компания ""Отель менеджмент""",«Первая»,5,10,«Третья»,1,4,,,,14
городская гостиница (отель),"Гостиница ""Ауринко"" ИП Русанова Валерия Николаевна","Гостиница ""Ауринко""",ИП Русанова Валерия Николаевна,Республика Карелия,100112044680,316100100058384,"185005, Россия, Республика Карелия, г. Петрозаводск, ул. Луначарского, д. 3",+7 (8142) 73-00-10,aurinko-hotel@yandex.ru,www.otel-karelia.ru,,две звезды,028,28.09.2020,55/028-2020,28.09.2020,28.09.2023,"ОБЩЕСТВО С ОГРАНИЧЕННОЙ ОТВЕТСТВЕННОСТЬЮ ""КАРЕЛСЕРТИФИКАЦИЯ""",«Первая»,8,15,«Вторая»,2,6,,,,21
"(До 31.12.2020) курортный отель, база отдыха, туристская база, центр отдыха, туристская деревня (деревня отдыха), дом отдыха, пансионат и другие аналогичные средства размещения","БАЗА ОТДЫХА ""ОНЕГО""\tГосударственное бюджетное образовательное учреждение дополнительного образования Республики Карелия «Ресурсный центр развития дополнительного образования» (ГБОУ ДО РК РЦРДО Ровесник)","БАЗА ОТДЫХА ""ОНЕГО""",Государственное бюджетное образовательное учреждение дополнительного образования Республики Карелия «Ресурсный центр развития дополнительного образования» (ГБОУ ДО РК РЦРДО Ровесник),Республика Карелия,1001049089,1051000023073,"185030, Республика Карелия, г. Петрозаводск,  ул.Повенецкая, 2",+7 814 253-50-64,turbazaonego@mail.ru,rovesnik.karelia.ru,,без звёзд,600,18.09.2020,78/17/600-2020,18.09.2020,17.09.2023,"Общество с ограниченной ответственностью ""Бюро классификации и экспертизы""",«Пятая»,11,45,,,,,,,45
городская гостиница (отель),"Гостиница ""9 Ночей""-Отель ""1774"" ИП Хромченков Илья Вадимович","Гостиница ""9 Ночей""-Отель ""1774""",Индивидуальный предприниматель Хромченков Илья Вадимович,Республика Карелия,100126026232,317100100018902,"185003,Россия,Республика Карелия, г. Петрозаводск, площадь Литейная, дом 3",+79116698511,ptz@9nights.ru,www.9nights.ru,,без звёзд,026,17.09.2020,55/026-2020,17.09.2020,17.09.2023,"ОБЩЕСТВО С ОГРАНИЧЕННОЙ ОТВЕТСТВЕННОСТЬЮ ""КАРЕЛСЕРТИФИКАЦИЯ""",«Третья»,8,32,«Четвертая»,1,6,,,,38
"(До 31.12.2020) курортный отель, база отдыха, туристская база, центр отдыха, туристская деревня (деревня отдыха), дом отдыха, пансионат и другие аналогичные средства размещения","Туристический комплекс ""ВелТ"" ООО "" ВелТ-Карельские путешествия""","Туристический комплекс "" ВелТ""","ООО "" ВелТ-Карельские путешествия""",Республика Карелия,1017009860,1031001190220,"186910,Россия, Республика Карелия, поселок Калевала, ул.Вяйнемейнена, дом 136","+7 (81454) 4-23-77, +7 9104444977",info@kalevala-welt.ru,www.kalevala-welt.ru,,две звезды,025,16.09.2020,55/025-2020,16.09.2020,16.09.2023,"ОБЩЕСТВО С ОГРАНИЧЕННОЙ ОТВЕТСТВЕННОСТЬЮ ""КАРЕЛСЕРТИФИКАЦИЯ""",Высшая «люкс»,3,6,«Первая»,12,24,«Третья»,3,13,43
городская гостиница (отель),"Хостел ""Брусника"" ООО ""КАРЕЛИЯ КОМФОРТ""","Хостел ""Брусника""","ООО ""КАРЕЛИЯ КОМФОРТ""",Республика Карелия,1001326536,1171001005746,"185035, Россия, Республика Карелия, г. Петрозаводск, ул. Антикайнена, дом 34, помещение 15",+7(8142) 63-58-00,brusnikapetrozavodsk@gmail.com,www.brusnikahostel120.ru,,без звёзд,022,28.08.2020,55/022-2020,28.08.2020,28.08.2023,"ОБЩЕСТВО С ОГРАНИЧЕННОЙ ОТВЕТСТВЕННОСТЬЮ ""КАРЕЛСЕРТИФИКАЦИЯ""",«Пятая»,11,52,,,,,,,52
