vid,polnoe_naimenovanie,socrshenoe_naimenovanie,naimenovanie_ur_litca_ip,region,inn,ogrn_ogrnip,adres,telephon,email,sait,spectialist_po_classificatci,prisvoenay_categoriya,nomer_resheniya_o_prisvoenii_categorii,data_resheniya_o_prisvoenii_categorii,registratcionnyi_nomer_svidetelstva,data_vydachi_svidetelstva,srok_deistviya,acreditovanaya_organizatciya,categoria_1,kol_vo_nomerov_categoria_1,kol_vo_mest_categoria_1,categoria_2,kol_vo_nomerov_categoria_2,kol_vo_mest_categoria_2,categoria_3,kol_vo_nomerov_categoria_3,kol_vo_mest_categoria_3,itogo_nomerov
городская гостиница (отель),Гостиница «Маршал» Петрозаводск ФГУП «Управление гостиничным хозяйством» Минобороны России,Гостиница «Маршал» Петрозаводск,ФГУП «Управление гостиничным хозяйством» Минобороны России,Республика Карелия,4617004041,1024600616150,"185030, Республика Карелия, г. Петрозаводск, ул. Лесная, д. 3","8-963-713-59-65, 8 (8142) 76-75-65",pzk@hotel-mo.ru,pzk-hotel.ru,Акутина Д.В.,без звёзд,А-294,02.11.2022,77/АА-94/А-294-2022,02.11.2022,01.11.2025,"Общество с ограниченной ответственностью  ""Академия Консалтинга""",«Первая»,4,7,«Вторая»,74,134,«Пятая»,4,5,146
городская гостиница (отель),"Гостиница ""Сортавала"" ИП Верба Д.С.","Гостиница ""Сортавала""",Индивидуальный предприниматель Верба Денис Сергеевич,Республика Карелия,780705836838,318784700204230,"186792,Россия,Республика Карелия, г.Сортавала, ул.Карельская, дом 35",+7(81430) 4-60-22,hotel@sortavala.ru,www.sortavala.ru,Сычева Любовь Алексеевна,две звезды,096,03.11.2022,10/АА-036/096-2022,03.11.2022,03.11.2025,"ОБЩЕСТВО С ОГРАНИЧЕННОЙ ОТВЕТСТВЕННОСТЬЮ ""КАРЕЛСЕРТИФИКАЦИЯ""",«Первая»,61,111,«Вторая»,6,9,,,,120
городская гостиница (отель),"Гостиница ""Ладога"" ООО ""Ладога-Тур""","Гостиница ""Ладога""","ООО ""Ладога-Тур""",Республика Карелия,1007012416,1021000945404,"186792,Россия,Республика Карелия, г.Сортавала, ул.Карельская, дом 12",+7(81430) 4-52-44,officeladogatyr@yandex.ru,www.ladoga-hotel.ru,Сычева Любовь Алексеевна,две звезды,094,03.10.2022,10/АА-036/094-2022,03.10.2022,03.10.2025,"ОБЩЕСТВО С ОГРАНИЧЕННОЙ ОТВЕТСТВЕННОСТЬЮ ""КАРЕЛСЕРТИФИКАЦИЯ""",«Первая»,29,51,«Третья»,8,24,,,,75
городская гостиница (отель),"Гостиница ""Хозяюшка"" ИП Шалыгина Г.Д.","Гостиница ""Хозяюшка""",Шалыгина Галина Даниловна,Республика Карелия,100400124645,304100236400059,"186931, Россия, Республика Карелия, г.Костомукша, бульвар им.Лазарева Г.Н.,дом 4",+7(81459) 7-35-35,xozayshka@list.ru,нет,Сычева Любовь Алексеевна,две звезды,093,03.10.2022,10/АА-036/093-2022,03.10.2022,03.10.2025,"ОБЩЕСТВО С ОГРАНИЧЕННОЙ ОТВЕТСТВЕННОСТЬЮ ""КАРЕЛСЕРТИФИКАЦИЯ""",«Первая»,18,23,«Пятая»,3,8,,,,31
городская гостиница (отель),Отель «Прионежский» ООО «Отель-Сервис»,Отель «Прионежский»,ООО «Отель-Сервис»,Республика Карелия,1001339447,1191001001795,"185035, Республика Карелия, г. Петрозаводск,  ул. Федосовой, дом 46",8 814 276 52 71,info@otel-petrozavodsk.ru,,Милованов Евгений Владимирович,три звезды,0174,13.09.2022,47/2/174-2022,13.09.2022,12.09.2025,"Общество с ограниченной ответственностью ""ОТЕЛЬ-КОНСАЛТ""",Высшая «люкс»,12,24,Высшая «джуниор сюит»,3,6,«Первая»,13,26,56
городская гостиница (отель),Мини-отель «Турист» ООО «Отель-Сервис»,Мини-отель «Турист»,ООО «Отель-Сервис»,Республика Карелия,1001339447,1191001001795,"185035, Республика Карелия, г. Петрозаводск,  ул. Красноармейская, дом 33",8 911 424 97 29,info@otel-petrozavodsk.ru,,Милованов Евгений Владимирович,три звезды,0173,13.09.2022,47/2/173-2022,13.09.2022,12.09.2025,"Общество с ограниченной ответственностью ""ОТЕЛЬ-КОНСАЛТ""",«Первая»,11,22,,,,,,,22
городская гостиница (отель),Гостиница «Петрозаводск» ООО «Отель-Сервис»,Гостиница «Петрозаводск»,ООО «Отель-Сервис»,Республика Карелия,1001339447,1191001001795,"185035, Республика Карелия, г. Петрозаводск, Центр р-н, ул. Красная, дом 28",8 911 400 56 46,info@otel-petrozavodsk.ru,,Милованов Евгений Владимирович,три звезды,0172,13.09.2022,47/2/172-2022,13.09.2022,12.09.2025,"Общество с ограниченной ответственностью ""ОТЕЛЬ-КОНСАЛТ""",«Первая»,38,74,,,,,,,74
городская гостиница (отель),"Гостиница ""Березовая роща"" ООО ""Спорт-Лига""","Гостиница ""Березовая роща""","ООО ""Спорт-Лига""",Республика Карелия,1001130974,1021000530242,"185001,Россия,Республика Карелия, г.Петрозаводск, ул.Калевалы, дом 2",+7(8142) 70-31-69,hotelroscha@yandex.ru,www.hotelroscha.ru,Сычева Любовь Алексеевна,одна звезда,089,13.09.2022,10/АА-036/089-2022,13.09.2022,13.09.2025,"ОБЩЕСТВО С ОГРАНИЧЕННОЙ ОТВЕТСТВЕННОСТЬЮ ""КАРЕЛСЕРТИФИКАЦИЯ""",«Первая»,9,18,«Вторая»,12,30,,,,48
городская гостиница (отель),Гостиница «Родина» ООО «Маяковский»,Гостиница «Родина»,ООО «Маяковский»,Республика Карелия,1007028180,1211000001024,"186791, Республика Карелия, м.р-н Сортавальский, г.п. Сортавальское, г. Сортавала, ул. Маяковского, д. 28",+7 (911) 967 07 17,rodina.karelia@gmail.com,www.rodina-karelia.ru,Ефипова Дарья Сергеевна,четыре звезды,24-р/2,31.08.2022,АА-145/029-2022,31.08.2022,30.08.2025,"Общество с ограниченной ответственностью ""Ассоциация экспертов туристской индустрии""",Высшая «люкс»,1,2,Высшая «джуниор сюит»,2,8,«Первая»,22,32,42
городская гостиница (отель),"Отель ""Лахти"" ООО ""ЛахтиТур""","Отель ""Лахти""","Общество с ограниченной ответственностью ""ЛахтиТур""",Республика Карелия,1001358217,1221000001441,"185005, Республика Карелия,  г. Петрозаводск, ул. Ригачина, д. 7А",+7(921) 932-63-56,info@lahti.ru,www.lahtitur.ru,Савосина Анна Игоревна,три звезды,Р-127,23.08.2022,77/131/127-2022,23.08.2022,22.08.2025,"Общество с ограниченной ответственностью ""Сателлит Компани""",«Первая»,13,26,,,,,,,26
"загородный отель, туристская база, база отдыха",База отдыха «Микли-Ольгино» ИП Павлова О.А.,База отдыха «Микли-Ольгино»,ИП Павлова О.А.,Республика Карелия,780434701055,317100100023452,"186724, Республика Карелия, Лахденпохский р-он, п. Микли, Район п. Микли ДНП, дом № 1981",8 921 986 18 31,mikli.olgino@gmail.com,,Милованов Евгений Владимирович,без звёзд,0158,08.08.2022,47/2/158-2022,08.08.2022,07.08.2025,"Общество с ограниченной ответственностью ""ОТЕЛЬ-КОНСАЛТ""",Высшая «люкс»,2,1,«Первая»,24,48,,,,49
мотель,"Мотель ""Вояж"" ООО ""КарелФармация""","Мотель ""Вояж""","ООО ""КарелФармация""",Республика Карелия,1001266083,1121001022526,"186220, Россия, Республика Карелия, г.Кондопога, Петрозаводское шоссе, дом 1А",+7(81451) 2-82-25,voyazh.kon.2013@yandex.ru,www.motel-voyage.ru,,две звезды,085,08.08.2022,10/АА-036/085-2022,08.08.2022,08.08.2025,"ОБЩЕСТВО С ОГРАНИЧЕННОЙ ОТВЕТСТВЕННОСТЬЮ ""КАРЕЛСЕРТИФИКАЦИЯ""",«Первая»,25,47,,,,,,,47
"загородный отель, туристская база, база отдыха","Эко-отель ""Harland Village"" ООО "" ТК Лигея""","Эко-отель ""Harland Village""","ООО "" ТК Лигея""",Республика Карелия,1001177852,1061001062902,"186130, Россия, Республика Карелия, Пряжинский район, Шуйская Слобода, Чалнинское сельское поселение, дер..Нижние Виданы, ул.Береговая, уч.13-14,",+7 9114050777,281031@bk.ru,harland-village.ru,,три звезды,084,29.07.2022,10/АА-036/084-2022,29.07.2022,29.07.2025,"ОБЩЕСТВО С ОГРАНИЧЕННОЙ ОТВЕТСТВЕННОСТЬЮ ""КАРЕЛСЕРТИФИКАЦИЯ""",Высшая «люкс»,2,4,«Первая»,2,4,,,,8
городская гостиница (отель),"Гостиница ""Белые мосты"" ООО ""Производственно-торговое предприятие ""Питкяранта""","Гостиница ""Белые мосты""","ООО ""Производственно-торговое предприятие ""Питкяранта""",Республика Карелия,1005080308,1021000906563,"186810, Россия, Республика Карелия, г.Питкяранта, ул.Ленина, дом 31А",+7 9214526503,oooptopit@mail.ru,www.belyemosty.ru,,две звезды,083,25.07.2022,10/АА-036/083-2022,25.07.2022,25.07.2025,"ОБЩЕСТВО С ОГРАНИЧЕННОЙ ОТВЕТСТВЕННОСТЬЮ ""КАРЕЛСЕРТИФИКАЦИЯ""",Высшая «люкс»,6,12,«Первая»,28,56,«Пятая»,33,122,190
городская гостиница (отель),"Гостиница АО ""Кондопожский ЦБК""",Гостиница,"АО ""Кондопожский целлюлозно-бумажный комбинат""",Республика Карелия,1003018230,1181001008517,"186220, Россия, Республика Карелия, г.Кондопога, ул.Советов, дом 14",+7(81451) 7-99-42,hotel@kbk.onego.ru,www.otel-v-karelii.ru,Сычева Любовь Алексеевна,три звезды,080,21.06.2022,10/АА-036/080-2022,21.06.2022,21.06.2025,"ОБЩЕСТВО С ОГРАНИЧЕННОЙ ОТВЕТСТВЕННОСТЬЮ ""КАРЕЛСЕРТИФИКАЦИЯ""",Высшая «джуниор сюит»,1,2,«Первая»,17,32,,,,34
"загородный отель, туристская база, база отдыха","База отдыха ""Черные камни"" ООО Охотничье хозяйство ""Черные камни""","База отдыха ""Черные камни""","ООО ""Охотничье хозяйство ""Черные камни""",Республика Карелия,1007013353,1031001532528,"186790, Россия, Республика Карелия, г.Сортавала, пос.Киркколахти","+7 (81430) 4-50-29, +7 9219671616",info@black-rocks.ru,www.black-rocks.ru,Сычева Любовь Алексеевна,три звезды,078,20.06.2022,10/АА-036/078-2022,20.06.2022,20.06.2025,"ОБЩЕСТВО С ОГРАНИЧЕННОЙ ОТВЕТСТВЕННОСТЬЮ ""КАРЕЛСЕРТИФИКАЦИЯ""",«Первая»,12,94,,,,,,,94
городская гостиница (отель),"Гостиница ""Каунис"" ООО "" Охотничье хозяйство ""Черные камни""","Гостиница ""Каунис""","ООО ""Охотничье хозяйство ""Черные камни""",Республика Карелия,1007013353,1031001532528,"186790, Россия, Республика Карелия, г.Сортавала, ул.Ленина, дом 3",+7 (81430) 4-52-10,hotelkaunis@onego.ru,www.hotelkaunis.ru,Сычева Любовь Алексеевна,две звезды,077,20.06.2022,10/АА-036/077-2022,20.06.2022,20.06.2025,"ОБЩЕСТВО С ОГРАНИЧЕННОЙ ОТВЕТСТВЕННОСТЬЮ ""КАРЕЛСЕРТИФИКАЦИЯ""",«Вторая»,18,30,,,,,,,30
городская гостиница (отель),Мини-отель «Aleon» ИП Сухорукова А.И.,Мини-отель «Aleon»,Индивидуальный предприниматель Сухорукова Алена Игоревна,Республика Карелия,100703891610,319100100025028,"186790, Республика Карелия, г. Сортавала,  ул. Бондарева, д.43",+7 921 016-09-09,hotelaleon@bk.ru,https://hotelriekkalansaari.ru/,Сычева Любовь Алексеевна,без звёзд,1301,10.06.2022,77/АА-79/1301-2022,10.06.2022,10.06.2025,"Некоммерческая организация ""Российская Гостиничная Ассоциация""",Высшая «студия»,1,2,«Первая»,2,4,«Третья»,1,4,10
хостел,"Хостел ""Best Friends hostel"" ИП Убоженков А.В.","Хостел ""Best Friends hostel""",Индивидуальный предприниматель Убоженков Антон Валентинович,Республика Карелия,101601767398,307103808800036,"185031, Рогссия ,Республика Карелия, г.Петрозаводск, набережная Варкауса, дом 1-а","+7 9215208499, +7 9114162452",antoxa_ves@mail.ru,http://bestfriendshostel.ru,Сычева Любовь Алексеевна,без звёзд,076,01.06.2022,10/АА-036/076-2022,02.06.2022,02.06.2025,"ОБЩЕСТВО С ОГРАНИЧЕННОЙ ОТВЕТСТВЕННОСТЬЮ ""КАРЕЛСЕРТИФИКАЦИЯ""",«Пятая»,6,24,,,,,,,24
городская гостиница (отель),"Мини-отель ""Герцена,16"" ООО ""Ником""","Мини-отель ""Герцена,16""","ООО ""Ником",Республика Карелия,1011003527,1021000977546,"186500, Россия, Республика Карелия, г. Беломорск, ул. Герцена, д.16",+7-921-62-07-490,nikom30@mail.ru,нет,Сычева Любовь Алексеевна,без звёзд,075,20.05.2022,10/АА-036/075-2022,20.05.2022,20.05.2025,"ОБЩЕСТВО С ОГРАНИЧЕННОЙ ОТВЕТСТВЕННОСТЬЮ ""КАРЕЛСЕРТИФИКАЦИЯ""",«Третья»,1,6,«Пятая»,3,10,,,,16
"загородный отель, туристская база, база отдыха","Загородный отель ""Верховье"" ИП Лазарев Евгений Алексеевич","Загородный отель ""Верховье""",Индивидуальный предприниматель Лазарев Евгений Алексеевич,Республика Карелия,100115818902,306100102300039,"185505,Россия, Республика Карелия, Прионежский район, деревня Верховье, ул.Биричево, д.11",+7 9218038595,info@hotel-verhovie.ru,www. verhovie.ru,Сычева Любовь Алексеевна,две звезды,071,18.04.2022,10/АА-036/071-2022,18.04.2022,18.04.2025,"ОБЩЕСТВО С ОГРАНИЧЕННОЙ ОТВЕТСТВЕННОСТЬЮ ""КАРЕЛСЕРТИФИКАЦИЯ""",«Первая»,12,24,,,,,,,24
"загородный отель, туристская база, база отдыха","Туристический комплекс ""Причал"" ООО ""Причал""","Туристический комплекс ""Причал""","ООО ""Причал""",Республика Карелия,1002001876,1021000843214,"186601,Россия, Республика Карелия, Кемский район, пос.Рабочеостровск, ул.Набережная, дом 1",+7 909567880,prichalkem@yandex.ru,www/prichalrk.ru,Сычева Любовь Алексеевна,без звёзд,072,22.04.2022,10/АА-036/072-2022,22.04.2022,22.04.2025,"ОБЩЕСТВО С ОГРАНИЧЕННОЙ ОТВЕТСТВЕННОСТЬЮ ""КАРЕЛСЕРТИФИКАЦИЯ""",«Первая»,50,85,«Пятая»,14,25,,,,110
городская гостиница (отель),Отель «Карлен» ООО «Рундук»,Отель «Карлен»,ООО «Рундук»,Республика Карелия,1012007644,1051002035480,"186730,Республика Карелия, г.Лахденпохья, ул.Ленина ,д.2А",8 (921) 526-85-05,www@ya.ru,,Пасько Ольга Владимировна,без звёзд,379,28.03.2022,АА-008/379-2022,28.03.2022,28.03.2025,"Общество с ограниченной ответственность ""НЦСЭ ""Хорекаэкспертгрупп""",«Первая»,7,14,,,,,,,14
городская гостиница (отель),"Отель ""Карьяла"" ИП Гришихин Н.В.","Отель ""Карьяла""",Индивидуальный предприниматель Гришихин Николай Владимирович,Республика Карелия,100702634586,314103529600023,"186790,Россия, Республика Карелия, г.Сортавала, ул.Садовая, дом 21",+79215207280,gyrmansort@mail.ru,www.otelkarjala.ru,Сычева Любовь Алексеевна,две звезды,070,24.03.2022,10/АА-036/070-2022,24.03.2022,24.03.2025,"ОБЩЕСТВО С ОГРАНИЧЕННОЙ ОТВЕТСТВЕННОСТЬЮ ""КАРЕЛСЕРТИФИКАЦИЯ""",«Первая»,6,12,«Вторая»,2,6,,,,18
городская гостиница (отель),"Гостиница ""Гостевой дом ""Благодать"" ИП Манукян А.В.","Гостиница ""Гостевой дом ""Благодать""",Манукян Агаси Вагаршакович,Республика Карелия,101200012424,314103510800010,"186792,Россия, Республика Карелия, г.Сортавала, ул.Фабричная, дом 11А",+7926211736,blagodat_manukyan@mail.ru,www.sortavala-blago.ru,Сычева Любовь Алексеевна,без звёзд,069,21.03.2022,10/АА-036/069-2022,21.03.2022,21.03.2025,"ОБЩЕСТВО С ОГРАНИЧЕННОЙ ОТВЕТСТВЕННОСТЬЮ ""КАРЕЛСЕРТИФИКАЦИЯ""",«Пятая»,7,17,,,,,,,17
комплекс апартаментов,"Коттеджи Терве Ранта, Terve Ranta Cottages ООО «ТЕРВЕ РАНТА»","Коттеджи Терве Ранта, Terve Ranta Cottages",ООО «ТЕРВЕ РАНТА»,Республика Карелия,1035000290,1201000007592,"Российская Федерация, Республика Карелия, Лахденпохский район, Куркиекское сельское поселение,  пос. Куркиеки, ул. Гористая 3а",+7 921-629-97-44,info@kala-ranta.ru,terveranta.ru,Бабыкина Наталия Сергеевна,две звезды,124,27.02.2022,78/АА-51/124/2022,27.02.2022,26.02.2025,Общество с ограниченной ответственностью «Специальная экспертная служба»,Высшая «апартмент»,4,8,,,,,,,8
"загородный отель, туристская база, база отдыха","Ландшафтный отель «Рантала» АНО ""ДТК ""СОРТАВАЛА""",Ландшафтный отель «Рантала»,"АНО ""ДТК ""СОРТАВАЛА""",Республика Карелия,1007003884,1021000944381,"186760, Республика Карелия, г. Сортавала, п. Кирьявалахти",8 (8142)445453,spir@rantala.su,,Пасько Ольга Владимировна,три звезды,364,23.02.2022,АА-008/364-2022,23.02.2022,23.02.2025,"Общество с ограниченной ответственность ""НЦСЭ ""Хорекаэкспертгрупп""",«Первая»,25,49,,,,,,,49
"загородный отель, туристская база, база отдыха","База отдыха ""Шишки"" ИП Кузнецов Максим Владимирович","База отдыха ""Шишки""",ИП Кузнецов Максим Владимирович,Республика Карелия,470804797617,314784702300361,"186220, Республика Карелия, Кондопожский район,урочище Шушки, 501-й километр автодороги ""Кола"" М-18, Санкт-Петербург-Мурманск","+7 9814054500, +7 9814054501",shishki-karelia@mail.ru,www.shishki-karelia.ru,Сычева Любовь Алексеевна,без звёзд,064,19.01.2022,10/АА-036/046-2022,19.01.2022,19.01.2025,"ОБЩЕСТВО С ОГРАНИЧЕННОЙ ОТВЕТСТВЕННОСТЬЮ ""КАРЕЛСЕРТИФИКАЦИЯ""",«Первая»,10,20,«Третья»,8,52,,,,72
городская гостиница (отель),"Отель ""Караван"" ООО ""Ресторан ""Караван""","Отель ""Караван""","ООО ""Ресторан ""Караван""",Республика Карелия,1001307477,1161001051067,"185002, Республика Карелия, г. Петрозаводск, ул. Муезерская, д. 15 А, стр. 9",+7 911 400 10 09,karavan_hotel@mail.ru,vk.com/karavan_hotel,Ефипова Дарья Сергеевна,четыре звезды,269-р/2,30.12.2021,АА-022/370-2021,30.12.2021,29.12.2024,"Общество с ограниченной ответственностью ""Эндикон-Эксперт""",Высшая «джуниор сюит»,2,4,«Первая»,8,16,,,,20
городская гостиница (отель),"ОТЕЛЬ ""ОНЕЖСКИЙ ЗАМОК"" ООО «ОТЕЛЬ-СЕРВИС»",ОТЕЛЬ «ОНЕЖСКИЙ ЗАМОК»,ООО «ОТЕЛЬ-СЕРВИС»,Республика Карелия,1001339447,1191001001795,"185035, Республика Карелия, г. Петрозаводск,  ул. Федосовой, д.44",+78142774999,onegozamok@onego-zamok.ru,,Алликас В.В.,три звезды,47/028/35-2021,28.12.2021,36-21,28.12.2021,27.12.2024,"Союз ""Ленинградская областная торгово-промышленная палата""",Высшая «джуниор сюит»,7,14,«Первая»,23,46,«Третья»,2,6,66
городская гостиница (отель),Гостиница «Сампо» ИП Тимонен Андрей Анатольевич,Гостиница «Сампо»,ИП Тимонен Андрей Анатольевич,Республика Карелия,101700001318,304100220500280,"186910, Республика Карелия, р-н Калевальский, пгт. Калевала, ул. Садовая, д. 2",+79217280559,timonen2013@mail.ru,,Акутина Д.В.,без звёзд,А-152,31.12.2021,77/АА-94/А-152-2021,31.12.2021,30.12.2024,"Общество с ограниченной ответственностью  ""Академия Консалтинга""",«Первая»,9,18,«Третья»,3,9,,,,27
городская гостиница (отель),"Отель ""Park Отель"" ИП Кириченко Юлия Викторовна","Отель ""Park Отель""",ИП Кириченко Юлия Викторовна,Республика Карелия,100123720562,321100100024027,"185007, Республика Карелия, г.Петрозаводск, ул.Парковая, дом 56А",+7 9317025966,Julie.m84@mail.ru,,Сычева Любовь Алексеевна,две звезды,062,22.12.2021,10/АА-036/062-2021,22.12.2021,22.12.2024,"ОБЩЕСТВО С ОГРАНИЧЕННОЙ ОТВЕТСТВЕННОСТЬЮ ""КАРЕЛСЕРТИФИКАЦИЯ""",«Первая»,8,16,,,,,,,16
